<?xml version="1.0" encoding="UTF-8"?>
<ns1:qdescriptor xmlns:ns1="preferencesAgent.com" xmlns:xsi="http://www.w3.org/2001/XMLSchema-instance" xsi:schemaLocation="preferencesAgent.com file:/C:/Users/eduardo.perrino/Documents/Redes%20sociales%20moviles/question_schema.xsd">  
    <question>
        <identifier>1</identifier>
        <topic>destinations</topic>
        <text>Â¿Te gusta viajar a londres?</text>
    </question>
    <proposal>
        <answer>
            <code>1</code>
            <text>si</text>
        </answer>
        <answer>
            <code>2</code>
            <text>no</text>
        </answer>
    </proposal>
<selected><answer><code>1</code><text>Texto de prueba</text></answer><comment>Comentario de prueba</comment></selected></ns1:qdescriptor>
